{
  "schema_version": 1,
  "corpus_date": "2026-09-23",
  "markdown": "docs/00-working/idea-partition-2026-09-23.md",
  "manifest": {
    "corpus_size": 383,
    "status": [
      "triaged"
    ],
    "shuffle_seed": 1370316527
  },
  "state": "proposed",
  "tracks": [
    {
      "name": "Idea system and knowledge retrieval",
      "groups": [
        {
          "name": "Idea ontology, tags, link vocabulary and lifecycle status",
          "ideas": [
            "000018",
            "000053",
            "000055",
            "000061",
            "000062",
            "000064",
            "000065",
            "000204",
            "000236",
            "000268",
            "000313",
            "000366",
            "000367"
          ]
        },
        {
          "name": "Idea management umbrella, metrics and capture delegation",
          "ideas": [
            "000008",
            "000010",
            "000050",
            "000071",
            "000127"
          ]
        },
        {
          "name": "Idea planner and scribe agents, and the requirements-versus-plans process",
          "ideas": [
            "000038",
            "000046",
            "000047",
            "000048",
            "000049"
          ]
        },
        {
          "name": "Partition process: pack reliability, harness constraints and thresholds",
          "ideas": [
            "000125",
            "000157",
            "000205",
            "000206",
            "000243",
            "000244",
            "000339",
            "000354",
            "000388",
            "000395",
            "000407"
          ]
        },
        {
          "name": "Explorer pages decision and build",
          "ideas": [
            "000042",
            "000299",
            "000300",
            "000301",
            "000302",
            "000303",
            "000304"
          ]
        },
        {
          "name": "The /idea workflow's unnamed temp-file location",
          "ideas": [
            "000305"
          ]
        },
        {
          "name": "Retrieval mechanisms",
          "ideas": [
            "000002",
            "000004",
            "000005",
            "000040",
            "000043",
            "000044",
            "000045"
          ]
        },
        {
          "name": "Knowledge-base architecture",
          "ideas": [
            "000060",
            "000161",
            "000162",
            "000163",
            "000164",
            "000167"
          ]
        },
        {
          "name": "Provenance graph and recommendation calibration",
          "ideas": [
            "000032",
            "000036"
          ]
        },
        {
          "name": "Temporal projection explorer",
          "ideas": [
            "000033"
          ]
        },
        {
          "name": "Portfolio scenario simulator",
          "ideas": [
            "000034"
          ]
        },
        {
          "name": "Routing brain procedures into the sessions that need them",
          "ideas": [
            "000216"
          ]
        }
      ],
      "disposition": null
    },
    {
      "name": "Agent engineering and review",
      "groups": [
        {
          "name": "Agent-engineering framework",
          "ideas": [
            "000078",
            "000079",
            "000080",
            "000081",
            "000082"
          ]
        },
        {
          "name": "Lifecycle agent roster and deliberation trio",
          "ideas": [
            "000072",
            "000073",
            "000074",
            "000075"
          ]
        },
        {
          "name": "Anti-pattern tracking and delegation scoping",
          "ideas": [
            "000097",
            "000136",
            "000138",
            "000139"
          ]
        },
        {
          "name": "Ephemeral purpose-built agents",
          "ideas": [
            "000169"
          ]
        },
        {
          "name": "Subagent truncation handling",
          "ideas": [
            "000077"
          ]
        },
        {
          "name": "Observability and telemetry",
          "ideas": [
            "000054"
          ]
        },
        {
          "name": "Review independence and model assignment",
          "ideas": [
            "000215",
            "000241",
            "000396",
            "000397"
          ]
        },
        {
          "name": "Independent adversarial session review",
          "ideas": [
            "000009"
          ]
        },
        {
          "name": "Harness guardrails: hooks, settings and preflight",
          "ideas": [
            "000012",
            "000014",
            "000051",
            "000346"
          ]
        },
        {
          "name": "Background-dispatch worktree hang",
          "ideas": [
            "000196"
          ]
        },
        {
          "name": "Commands, skills and agents audit",
          "ideas": [
            "000126"
          ]
        },
        {
          "name": "Provider portability of agent definitions",
          "ideas": [
            "000069",
            "000306"
          ]
        },
        {
          "name": "Repo tracker and multi-repo memory agent",
          "ideas": [
            "000086"
          ]
        }
      ],
      "disposition": null
    },
    {
      "name": "MCP mediation and autonomous operations",
      "groups": [
        {
          "name": "MCP-mediated access, enforcement harness and migration",
          "ideas": [
            "000020",
            "000151",
            "000156",
            "000159",
            "000160",
            "000165",
            "000166"
          ]
        },
        {
          "name": "Capability broker and its denial taxonomy",
          "ideas": [
            "000031",
            "000326",
            "000333"
          ]
        },
        {
          "name": "Trigger gateway, run ledger and worker host",
          "ideas": [
            "000028",
            "000029",
            "000030",
            "000349"
          ]
        }
      ],
      "disposition": null
    },
    {
      "name": "Idea realization and multi-session coordination",
      "groups": [
        {
          "name": "Realization system formalization and daemon reach",
          "ideas": [
            "000247",
            "000248",
            "000249",
            "000250"
          ]
        },
        {
          "name": "Queued-phase review defects",
          "ideas": [
            "000251",
            "000252",
            "000253",
            "000254"
          ]
        },
        {
          "name": "Orchestrator code defects",
          "ideas": [
            "000338",
            "000348",
            "000350",
            "000352",
            "000355",
            "000356"
          ]
        },
        {
          "name": "Session Manager roster, state and messaging",
          "ideas": [
            "000128",
            "000319",
            "000320",
            "000327",
            "000328",
            "000332",
            "000334",
            "000340",
            "000347",
            "000358",
            "000359",
            "000369",
            "000370",
            "000389",
            "000391",
            "000404"
          ]
        },
        {
          "name": "Orchestration shape and assurance: the 000385 anchor's design questions",
          "ideas": [
            "000385",
            "000386",
            "000387",
            "000392",
            "000393"
          ]
        },
        {
          "name": "Batch and wave coordination packs",
          "ideas": [
            "000235",
            "000316"
          ]
        }
      ],
      "disposition": null
    },
    {
      "name": "Concurrency, claims, backlog and git safety",
      "groups": [
        {
          "name": "Abandoned-claim recovery and clobbering prevention",
          "ideas": [
            "000025",
            "000041"
          ]
        },
        {
          "name": "Worktree registry and responsibility inventory",
          "ideas": [
            "000152",
            "000168",
            "000368",
            "000390"
          ]
        },
        {
          "name": "Hand-off protocol drift",
          "ideas": [
            "000153",
            "000154"
          ]
        },
        {
          "name": "Identifier-allocation collisions",
          "ideas": [
            "000158",
            "000283",
            "000318"
          ]
        },
        {
          "name": "Multi-machine and multi-developer claims",
          "ideas": [
            "000280",
            "000288"
          ]
        },
        {
          "name": "Long-lived shared branches versus the claim protocol",
          "ideas": [
            "000217",
            "000285"
          ]
        },
        {
          "name": "Lock-check blind spots and declared-path enforcement",
          "ideas": [
            "000027",
            "000239",
            "000242",
            "000245",
            "000321",
            "000322",
            "000336",
            "000398"
          ]
        },
        {
          "name": "System decomposition for false mutexes",
          "ideas": [
            "000234",
            "000284"
          ]
        },
        {
          "name": "Backlog file shape and write safety",
          "ideas": [
            "000037",
            "000224",
            "000240"
          ]
        },
        {
          "name": "Backlog review and re-prioritisation recipe",
          "ideas": [
            "000011"
          ]
        },
        {
          "name": "Phase versus claim-free fix branch rule",
          "ideas": [
            "000403"
          ]
        },
        {
          "name": "Branch protection and push-rule wording",
          "ideas": [
            "000066",
            "000091"
          ]
        },
        {